user_id,user_name,comment,comment_date
3687216,Yelda Basar Moers,"""Painting is the silence of thought and the music of sight."". I adore this book, a love story and philosophical thriller immersed in the life of miniature painting in the Ottoman court. I found myself spellbound by its prose the first time I read it! And now even more so with the second read. Nobel-prize-winning Turkish author Orhan Pamuk has a style reminiscent of Borges, Proust and Nabokov. A soulful, dreamy quality emanates from his sentences and chapters, which read like an epic poem as much as they illuminate with vibrant storytelling. There are so many poignant and poetic phrases, such as ""I don't want to be a tree, I want to be its meaning,"" ""to paint is to remember,"" and ""time doesn't flow if you don't dream."". My Name is Red is set in the 16th century Ottoman Empire and chronicles the lives of a workshop of miniaturists who have been commissioned by the reigning Sultan to complete a book of paintings. Two of the members are murdered and the main narrative follows the trail of discovering the culprit. It is a philosophical thriller but also a love story. One of my favorite passages from the book is the following: ""Tell me then, does love make one a fool or do only fools fall in love?"". There are at times the most intricate details about miniature painting and multiple narratives that switch with each chapter (there are a total of twelve narrators, among them the main characters, but also Satan, Death, a Tree and a Dog). The book has its own original form, almost as a miniature painting in itself, and delves into the life of 16th century Islamic miniature art in a way that few books can do. Orhan Pamuk himself won the Nobel Prize for Literature in 2008. His writing enchants and leaves me breathless every time! He's written a number of novels, essays and a beautiful memoir about Istanbul, the city my father was born and raised in. I've read several of his books and I look forward to reading the rest of his oeuvre!. Some critics say the novel is dead, but My Name is Red is an example of how the novel is very much alive. Here is a living, breathing piece of life and art. It’s truly a masterpiece. A contemporary classic, if such a category is possible, for we know it will go into the canons of great literature.","Jun 05, 2011"
66366804,Usman Hickmath,"Reading My Name is Red was like having a candle light dinner with the loved one on honeymoon. A very rich experience which will be in memory for a long time.. There is love, there is art, there is heartbreak, there is mystery and history in this wonderfully crafted master piece.. You will come across stunning lines like these page after page.. ”Painting is the silence of thought and the music of sight”'. “Color is the touch of the eye, music to the deaf, a word out of the darkness”. “Love comes after marriage. Don’t forget: Marriage douses love’s flame, leaving nothing but a barren and melancholy blackness. Of course, after marriage, love itself will vanish anyway; but happiness fills the void. Still, there are those hasty fools who fall in love before marrying and, burning with emotion, exhaust all their feeling, believing love to be the highest goal in life”. “I can’t read what’s written, but I can always have someone else read it. And as for what’s not written, I can quite readily “read” that myself” – An illiterate courier who carriers letters between three main characters.","Mar 28, 2017"
5459072,Neal Adolph,"Let me be careful here, talking about this big and beautiful book. The three stars doesn't reflect the heights that it brought me to, the excitement it filled me with, the thrill of beautiful language and beautiful imagery, of endearing characters and of interesting ideas. No, the three stars doesn't capture that, and so I think you would be mostly wise to ignore the stars entirely; maybe you can even forgive me for having used stars. I like them. They are pretty.. But I can't give the book more than three stars in good conscience, and so I have settled on that worst of all the numbers - the one that spreads from the truly disappointing. The Human Stain. to the passable and pleasant. The Glassy Sea. to the endearing and enduring. Segu. - in the hopes that you will overlook the writing and give this book a chance one day. It contains a lot of gems.. The most prominent of those gems is, I would say, the writing, which at times is over-indulgent, but is almost always beautiful. When it gets going, when its pacing is just right, it reaches the heights of Garcia Marquez and Rushdie, the high romanticism of euphoria. When it isn't quite right it fumbles in search of some good editing.. The next most prominent is the theme, or the layers of themes, which fill this book. It plays with art, predominantly, and how that art should be informed by society or shouldn't be, and what kind of relationship we can have with art. It ranges from the obsessive, to the conservative, to those desiring mass changes to the standard to those hoping to protect. It tosses in colonialism, and the political battles between East and West at the end of the 16th Century. It discusses power, of course, as all things do. It really does all of these things wonderfully, beautifully, wrapping it all in the often miraculous words and sentences and images that I referenced above.. The next most prominent, for me, is the depth of the world that we are shown in this book. This is a strength, though I found it difficult for me to interact with it at times given my extreme ignorance of the region, the religion, the history and context. But it is lovely, and rich, in its representation here. I was often totally impressed by the meta-fictional references to literature from 450 years ago. I was often totally impressed by the body of parables that Pamuk brings to the table. This is clearly a world very different than anything I have ever experienced, and it is, in many ways, a beautiful place to let your mind explore for a bit.. The next most prominent are the voices. There are a lot of them in this book with each chapter having a different narrator than the one which preceded it. At times those voices are from inanimate objects which have some grand story about how they have come to exist, and that, in their way, add some kind of commentary onto the book. I love thinking of being told a story by a coin, a tree drawn on paper, a skull, the colour Red, but I also came to admire the intelligence of Black, of Osman, of Shekure, and, most of all, of Esther. The characters here are endearing, memorable, pleasant to witness and read the world with.. So the voices are great, and they make great characters. Except for those characters which are, perhaps, most important to the central murder plot. Butterfly, Stork, Olive, and Elegant are all difficult to differentiate from each other. I guess that is important as plot device, but it makes the plot seem like it is fluffy - a poorly disguised vehicle to explore some of the ideas which the author found more intriguing. And here is the cause of the three stars (everything I have said thus far would suggest that the book is worthy at least of 4, no?). The plot is difficult to make sense of as it develops and, when it does take on some kind of concrete form for the reader, it ultimately feels like it is borderline absurd or silly, and really not of any great consequence. It has its strong moments, of course, but it also had its weak moments - and unfortunately, it ends on a moment of weakness rather than power.. But I don't think anybody is really going to come away from this book feeling like they read it for the story or plotline - at least, I hope not. It contains something far more important to offer us, stories and ideas far more intriguing than the story we are witnessing. I would like to come back to it after learning more about Turkey and the Ottoman Empire, maybe after reading more by Pamuk. I suspect there are a great many secrets I have missed entirely. Illuminated scripts sound enchanting and this book may be as well.","Nov 15, 2016"
21812440,Erwin,"An exceptional novel. A great picture of 16th century Ottoman Empire. A very interesting lesson in Ottoman/Islamic art history. I do believe, however, that I missed clues due to my lack of knowledge on the topic, on the other hand that is a great excuse for a reread.","May 31, 2016"
4684009,WILLIAM2,Fabulous. A relentless read for me.,"Mar 24, 2011"
55219317,Amber,"""Books which we mistake for consolation, only add depth to our sorrow""","Apr 07, 2019"
6942006,Suzy,"I have a love/hate relationship with this novel of a group of miniaturists who illustrate Islamic texts in the 1500's.. Love: the unusual way it's written; the cast of characters, who speak for themselves in chapters titled ""I am called Black"" or ""I am a coin"", for example; learning about miniatures, the rules of Islamic art, and the culture of the groups of illustrators that create them; that it's a murder mystery, love story and a cultural treatise on the changes going on at this point in time when influences from Europe were changing art; that it led me to exploring more about art from this era - fascinating!. Hate: went on for way too long and after about 40% of the 20+ hours (count them!!!!) it devolved into a boring story of which miniaturist drew what in order to figure out who the murderer was, how they either went blind or put their eyes out because blindness was a source of pride, etc. etc. I was ready to poke my own eyes out!. But I persevered and listened to the entire thing. John Lee did an admirable job in voicing all the characters and I'm glad I read this even though I didn't like it as much overall as I did in the first part. It could have been exhilarating if the second 60% had been condensed.","Dec 17, 2016"
833700,Kirsten ,"This book was gilded by beautiful language, much like the paintings in the novel were gilded by the poor Elegant Effendi.. This was a mystery in a beautiful setting and beautiful language. I could not read this book too fast. Many paragraphs and chapters I had to re-read to make sure I was getting the full meaning. That's not too say this book was dense or hard to read. It is just that it is a book to be savored.. The mystery plot was well thought out and the use of multiple points of view - while frustrating at times - made for an excellent plot.","Dec 09, 2016"
7392004,Quo,"My Name is Red. is a novel on a grand scale, set in 16th century Istanbul, a tale that is complex, wondrous & at times humorous but which also represents an occasionally frustrating blend of Turkish history, autobiographical detail & ultimately a murder mystery that sweeps the reader into the late medieval Muslim world of miniaturist art & the lives of those devoted to creating it. Orhan Pamuk's masterful work of fiction can be compared to Herman Hesse'. Magister Ludi. (The Bead Game) and Umberto Eco's. The Name of the Rose. .. The first person narrative includes the primary miniature artists, including Olive, Stork, Butterfly & Black but also extended to their mentor & head illustrator, Osman, Black's beloved, Shekure, a tree, a horse, a dog, a corpse, Satan & two dervishes. The elaborate cast of characters stating their case even includes the color red, becoming akin to an active character in the novel. In an attempt to describe how these many divergent voices interact with each other, I would suggest that. My Name is Red. functions as a kind of morality play pitting opposed forces against one another--good vs. evil; east vs. west, with Istanbul as crossroads; traditional Muslim miniaturist art vs. the encroaching force of Venetian or ""Frankish"" (western) art that is more representational & more personal; and even Persian military strength & Chinese influence arriving via the Silk Road, viewed as a threat to Islamic art, to the Koran & to the Turkish interpretation of history.. However, of the many infidel or non-Islamic incursions, the greatest peril occurs when the sultan sends envoys to Italy to view Venetian paintings that are far different from traditional miniaturist art in terms of style, use of color, the manner in which the characters are personalized & even the employment of the artist's signature on the painting, all of which are seen by some as a distinct threat to Islamic values. For, traditional miniaturist art is representational only in a vague manner, most certainly never portraying specific or recognizable faces rather than generic figures. It is declared by a renowned Islamic historian from Herat in present-day Afghanistan that ""the greatest sin of the devil is to say. I. "". Alas, there are a great many ""infidel influences"", coffee among them. Here is just one view of the way in which the work of a miniaturist is viewed:. We mistakenly assumed that these stories arose out of words & that illustrations were painted in service to these stories. Quite to the contrary, painting is the act of seeking out Allah's memories & viewing the world as he sees it. A miniaturist united with the vision & landscape of Allah's immortal time can never return to the manuscript pages meant for ordinary mortals.. My Name is Red. is exceedingly dense at times, introducing Turkish history & rarefied words dealing with miniature art that have a particular meaning only in the context of the story, while at the same time conveying a rich tapestry of detail that with each page causes the reader to become increasingly invested in this amazing jigsaw puzzle of novel. One of the considerable allegorical tools used by Orhan Pamuk in. My Name is Red. is countering the illumination of visual detail via illustration with blindness. The author does this very adeptly throughout his novel. Miniaturists are so devoted to their craft that eventual blindness is seen as a gift.. They accepted the work, the endless drawing & staring at pages by candlelight for days without break, as the pleasurable labor that delivered the miniaturist to blindness, with some seeking out the most appropriate moment for this most glorious of approaching eventualities, either by purposely hurrying blindness through the painstaking depictions of trees & all their leaves on fingernails, grains of rice & even on strands of hair, or by cautiously delaying the imminent darkness by the effortless drawing of pleasant sun-filled gardens. Some of the miniaturists of the old style look upon blindness as the greatest virtue of Allah's grace & they are embarrassed by growing old but not blind.. Later in the novel, a miniaturist intentionally blinds himself in order to ""preserve his vision"" of art within his consciousness, while not being called upon to adjust to a changing style, while another artist is blinded by a rival. The questions arises as to whether the measure of a miniaturist's talent is to depict everything with perfection or to introduce into the picture that which no one else can see. Always, art is driven by an intense life-force which can either ""force the most devout man to renounce his faith or bring the most hopeless, unrepentant unbeliever to Allah's path"". For, if an artist draws a horse differently, he begins to see the world differently, with the ensuing personal style seen as leading to damnation.. What attracts us to writing, illustrating & painting in bound up in a fear of retribution. We also want those we have forsaken to see & appreciate the inspired pictures we've made, even if they should call us sinners. Genuine painting is hidden in the agony no one sees & which others will call bad, heretical or blasphemous. Oh the suffering this brings upon the painter of genuine talent, a frightful, nerve-wracking experience! The birth of a new style vs. imitation of an old one results in years of disagreements, jealousies & rivalries.. There is murder embedded within. My Name is Red. but to even hint at the complexity to this aspect of the novel might come close to revealing the mystery that is at the heart of Orhan Pamuk's master work. What constituted for me much of the beauty of this expansive novel was the author's attempt to have the reader see the world through the eyes of the characters in a miniature painting, to drop back in time as it were & to visualize Istanbul in the 16th century, with each element of this mosaic of characters having a distinct voice, even if the reader is a. Frank. (non-Islamic) spectator ""committing the error of looking at the world with his naked eye & rendering what he saw."". As with the title of the Pamuk novel, red is more than just a color in the miniaturists' palate but has a metaphorical & symbolic role to play, merging bloodshed with a dominant, forceful color, as when a character intones, ""we imagined how we watched with pleasure the slow spread of a deadly red seeping from a bronze inkpot that had cracked over a page 3 illuminators have labored on for 3 months."" Likewise, there are frequent references to the early 11th century Persian epic, the. Shahnameh. (""Book of Kings"") by Ferdowsi & to the tale of Husrev & Shirin, a 12th century Persian work by Nizami. There are elements in. My Name is Red. that bear witness to these classic stories & others that are drawn from the author's own life.. I have chosen to focus on the craft of painting & illustration in my review because it was through a long consideration of the process of painting that Orhan Pamuk was able to distill his knowledge of miniatures into the tale that eventually became the novel. However, in this way, I can also avoid dealing with spoiler alerts & leave the solution to the novel's great mystery component to future readers.. My Name is Red. represents a fusion of words & colors, of narrative tale & miniature art + the fairy tale-like material derived from classical Islamic literature, all in all, a magical blend.. *The author's very personal introduction in my Everyman's Library/Alfred A. Knopf version of the novel is extensive & stands as an overview of the gestation process for. My Name is Red. , 6 years in the process of writing but reflective of the author's lifetime of interest in painting in general & specifically the world of miniature art. The translation from the Turkish was by Erdag Goknar. **The map & historical chronology were also quite helpful.","Sep 16, 2019"
1207684,Bruce,"This novel by Orhan Pamuk, Nobel Prize in Literature-winning Turkish author, is creatively written and raises intriguing questions about the process of artistic production.. Using the chronology at the end of the book, I conclude that the book’s events are taking place at the end of the 16th century. The multiple perspectives - each short chapter reflects a different one - seem to be different characters. The setting is Istanbul. A murder has occurred. Who is the murderer? “Olive” or “Stork” or “Butterfly”? Woven throughout this fascinating philosophic and artistic treatise is an engaging mystery story. Another murder occurs; we know the murderer but not his name. Black and Sekure finally get married, an apparent resolution of sorts but too early in the book, just halfway through, to be convincing as the reliever of tension. And indeed, complications immediately begin to arise. Now the artistic argument is turned on its head, and Horse asserts that the painting of Generic Horse, or the Form of Horse, is idolatrous and that the painting of the particular as it simply is seen is preferable. The plot becomes more dangerous, the outcome unclear until the novel’s very end.. The main characters are artistic miniaturists, illustrators of manuscripts. Tiny hints in each chapter, often just a word or a phrase, provide linkages between chapters and clarify relationships between characters. These make the narrative comprehensible. A key issue or question involves the process of artistic creation, whether the perfection of creativity is originality or rather whether true virtuosity consists of absolute subjugation of the artist to tradition, without any evidence in the work of his own “style” or signature characteristics, ie keeping himself absolutely anonymous. There is initial discussion of the Islamic injunction against specific artistic representation of objective reality vs Venetian portraiture, representation of a specific individual person, thus identifiable. This issue is at the root of the issues to be explored in this novel. The desire for originality by an artist seems to imply the desire for personal renown, and that is to imply a fall from perfection, perfection in a work of art implying purity, without any reference to the artist. The perfect artist would create the same work of art again and again, precisely the same each time, doing nothing to draw attention to himself as creator. Representational painting elevates the importance of the object represented and runs the risk that the representation itself will come to be worshipped, a form of idolatry. By extension, all art - consider, for example, literature - becomes the product of a human creator imitating or even co-opting the office of the Divine. Art, like language, becomes not only an abstraction from and of reality, and thus “art-ificial” but also a temptation, the seduction being that it might be valued not only in and of itself but also above Reality. This argument of course has validity only if one posits a Creator outside Creation; if one denies that, then any creation has equal validity and value.. Again and again the narrative explores the nature of art, the differences in both technique and philosophy between Islamic and European painting. I am fascinated by the insights into Islamic illumination of manuscripts and miniature painting. Social customs are interesting, too. A recurrent theme is the waning of the artistic paradigm of the Ottoman region and era, that of ornamentation, in favor of the European (Venetian and Frankish) paradigm of representation, the former eventually succumbing to the latter. Neither really reflects reality but rather a frozen and static moment that presents emotion only with difficulty.. The conservative nature of established religion, considering anything innovative heretical, is certainly still with us. “Two styles heretofore never brought together…come together to create something new and wondrous…May (Allah) protect us from the will of the pure and unadulterated.” That is the liberal challenge. “A great painter does not content himself by affecting us with his masterpieces; ultimately, he succeeds in changing the landscape of our minds.” This is the promise, and this is the threat. Is there something about Islam that is fundamentally conservative vis-à-vis Christianity and Western Civilization? While that point is debatable, it is also probably too baldly stated. Both clearly have conservative and liberal elements, but one gains the impression in this book that Pamuk is asserting that the emphasis of the former is more conservative. I found this work fascinating and challenging, raising important issues and questions. Pamuk writes very well, and his style is engaging. There are hints throughout the book pointing to the often critical reception that his writing has received in his home country.","Apr 17, 2011"
