user_id,user_name,comment,comment_date
8462660,Jacoline Maes,"4,5 stars. This book is interesting and beautifully written. The characters that tell the story are surprising and I really liked how everything came together in the end. It was unpredictable and most of the time I wanted to know what would happen next. The only reason I can't give this the full five stars is because of some slower parts that made me feel less excited about this book, but luckily after that the pace picked up again. A book I highly recommend.","Apr 22, 2017"
58657487,Tony Salter,"It was beautifully-written and cleverly-plotted ... but the level of detail!!!! I must admit that I know rather more than I need to about the history of miniaturism in Ottoman Turkey.. I saw Orhan Pamuk speak a few weeks ago and am not surprised that the book was that detailed, as he clearly has a very big brain.. I'm glad I read it as it has been sitting on my shelves for ages, but would I read another? Not anytime soon.","Nov 06, 2017"
8686546,Feyzan - The Raven Boy,"A great mix of history, art, romance and mystery. I was flipping pages in panic and excitement throughout. This book had an engrossing story, beautifully interwoven history ornated with exuberant writing. A perfect blend one could ask for. I don't regret one bit staying up at night to finish this book. It was really, really good.. However, it definitely had some boring bits too. In my opnion this could have been better if it were a 100 pages shorter.","Oct 16, 2018"
1595626,Atishay,"Very Orignal in its styling, Orhan Pamuk is a very creative storyteller. An amalgam of history and fiction, this book revolves around the lives of miniaturists. Typically a murder mystery, Orhan Pamuk portrays love and instinctive human emotions with ease and grace.. I'd recommend it to anyone who is looking for a nice change of reading something different and beautiful.","Oct 12, 2008"
51510878,Tahera,"I loved reading this book, especially for the way it is written. The narrative is not linear and so it makes for an interesting read. Part love story, part murder mystery, My Name is Red takes you to the times when miniaturists played an important part in art and especially in Islamic Culture. I had heard a lot of praises for the book, and I wasn't disappointed at all.","Sep 14, 2016"
95284601,Jetmira,Meh... this book was boring!,"Feb 11, 2020"
1628041,Book Concierge,"Book on CD performed by John Lee. Set in 16th-century Instanbul, this is a murder mystery, an art history lesson, and a love story all in one. The Sultan has commissioned a new book and directs Enishte Effendi to appoint a group of acclaimed miniaturists to illuminate the manuscript “in the style of the Franks.” But figurative art can be seen as an affront to Islam, so it’s a dangerous commission that must remain secret, and no one in the group knows the full scope of the project. When one of the artists disappears, the Sultan demands answers within three days. Was this the work of a devout follower of Islam, or is this a case of jealous rivalry for the hand of Enishte’s beautiful daughter Shekure?. I’ve had this on my tbr for a long time. I really enjoy reading international literature, and this one puts me smack dab into the world of historic Istanbul. But I found it difficult to follow because of Pamuk’s unusual style. Each chapter has a different narrator – including not only the major characters (Black, Shekure, Esther, Butterfly, etc), but a corpse, a tree, a dog, an ancient coin, and even death. Each chapter is written in first person giving the reader only that narrator’s perspective.. When he focuses on the murder and the investigation, the story is quite compelling. However, Pamuk also includes long passages on art, the history of Turkey, and the teachings of Islam. Some of these helped me to understand the culture and the references, but mostly they interrupted the story arc and sometimes had me scratching my head wondering what I had just missed.. The audio book is masterfully performed by John Lee, whose voice reminds me of Jeremy Irons. He really had his job cut out for him, given the style of writing and the many characters. There were times when I had to read the text to be sure I hadn’t missed something. Still, Lee was definitely up to the task. I would rate his narration at 5 stars. Bravo.","Mar 14, 2018"
36586786,Shaima Faisal,"Winter days in Istanbul, the Ottoman Empire in 1591, during the reign of Sultan Murat III.. The Sultan assigned the task of commissioning a book to Enishte Effendi, the father of beautiful Shekure and maternal uncle of Black. The book is supposed to depict the victories and powers of the Ottoman Empire and the Sultan himself, and will be released to celebrate the 100th anniversary of the Prophet’s Hijra.. A mysterious murder coincide with the arrival of Black, after 12 year of exile. Now, Enishte Effedi who needs to complete the book before the deadline, assigned Black to replace the murdered miniaturist. In order to gain back Enishte’s and Shekure’s trust and love, Black accepted the challenge.. With the rise of the Erzurumi movement, a group of religious people that oppose illustration altogether considering it as a form of blasphemy, and the confusion and greed that Enishte’s team of miniaturist face because they are used to and was trained to illuminate using the Ottoman style but asked to adopt the Frankish style in illustrations within the book, another crime occurs.. A parallel line in the novel is the love story of Black and Shekure, a reflection of the tragic romance story of Hüsrev and Shirin, borrowed from the famous epic “Shahnameh Dear ” written by Ferdousi and elaborated by Nezami in his “Panj Ganj/Khamsa”. The tragic ending of Chief Miniaturist Master Osman emulating the blindness of the legendary miniaturist Bihzad represents the end of the Ottoman miniature because after that, the miniaturists follow the Frankish style.. The novel is heavy and dense with details and metaphors. I felt sorry for myself because I should have read the “Shahnameh” beforehand. Nevertheless, I enjoyed reading it. Pamuk reminded me of Eco in “The Name of The Rose”. Ok, this is my first experience with Pamuk, and surely will not be the last.","Jul 22, 2018"
3007716,Meg,"My Name is Red. my first stray into Turkish fiction so I'm not sure if the resonance the themes had with me had more to do with Orhan Pamuk's personal preoccupations or Turkey's wider preoccupations as a society and culture. Probably both, since by dint of geography and history, Turkey becomes the stage for competing influences from Europe and Asia. I wonder why I never realized before that Turkish literature might be the best place to find works expressing this existential angst of being caught between East and West, which is kind of the basis of my identity, if we're getting armchair psychologist here. I gotta to say to all these characters in. My Name is Red. being torn apart having to deal with the friction between eastern and western traditions and struggling to re-negotiate their identity: I get it. I feel y'all. It was so nice to see this played out in literature!. The murderer in. My Name is Red. --a miniaturist painter who kills two other artists over a book threatening to introduce the western philosophy of painting to Turkish painting -- is especially fascinating. He's of course driven by feelings of superiority and rage, which are emotional motives. But his intellectual reasons are fascinating: both wanting to cling to tradition and wanting to discard it, wanting to be part of a society that values the collective ( which he grew up in) while secretly wanting to be part of society that places the individual above all else. Who doesn't want to believe they are unique and special? Such is the siren song of individualism. A tempting enough creed to anyone with an ego; but even more tempting to a gifted artist wanting to be lauded as a master, but slavishly bound to a workshop's and culture's orthodoxy.. Denial of style, of his identity, leads him to murder-- I can't help but thinking of that amazing scene where he tries but fails to draw an accurate self-portrait of himself, in the style of the Venetians. Now, I don't know if anyone actually has been incited to murder (I hope not) over miniaturist painting, or because they can't resolve the tensions between individualism and collectivism and east and west. (Most certainly they have due to the sparring between traditional and modern concepts). Of course, in real life a murderer driven by these motives would be ghastly indeed, but put it into a novel, intellectualize and make it literary, by having a character be so tormented by these discordant philosophies: it's really brilliant. The other intellectual murderer I thought of while reading this novel is Dostoyevsky's Rodion Raskolnikov from. Crime and Punishment. ; one of literature's greatest character studies. What I'm trying to say is I've realized I dig intellectual murderers at the center of a plot in novels, as a way to explore societal pressures, and as a character's futile attempt to remake or understand oneself. I wonder if these tormented literary murderers tend to be male characters, however. The murderesses I've read in literature tend to kill as an act of protest or desperation after a lifetime of degradation. So, if anyone knows of an intellectual woman murderer in literature--someone who commits murder because they are trying to understand their identity or test their personal philosophy-- do recommend!. Another thing I wanted to note about. My Name is Red. : I think it's helped me view painting in a different way. I happened to be visiting a lot of art museums during spring break while reading this book, and I found myself looking at paintings in a different way because of it. Crossing from adjacent rooms dedicated to the 13th, 14th, 15th, and 16th century European painting, I finally understood on a deeper level how revolutionary the theory of perspective was at that time. What more can you ask of literature? If it can change or enrich the way you observe or interpret things in the smallest way, or make you re-evaluate or better understand a concept, it has been successful. Also, I don't think I've ever seen Turkish miniature paintings in person, but now I'm super curious. According to Pamuk, Muslim artists were attempting to paint the world as God perceived it, not as humans did, and artistic perfection was the flawless imitation of old masters. It's a philosophy of art that I hadn't thought of before, but no less valid than the western tradition I'm familiar with.. This is a novel of ideas. With the exception of a few instances, Pamuk presents his themes in an adept way--not too overbearing. There's definitely a lot of things he raises in the novel that I want to chew over still. To paraphrase: is style merely imperfection, not individualism? Are all pictures only possible through memory, even if what you're drawing is in front of you? Does a painting achieve legendary status for its nature or what is said about it? Is beauty really just the eye discovering what the mind knows already?. Right now I'm rating this book four stars, partly because I struggled to stay engaged at a few points in the novel--in particular, I'm thinking of when Pamuk took us away from the plot and made us read nine parables in a row (""Alif,"" ""Ba"" and ""Djim"") and then told us how we should interpret these parables-- quite tiresome. Still, I suspect this book might come to have a special staying power for me, so don't be surprised if I eventually upgrade it to 5 stars.. Some quotes I liked:. ""I don't want to be a tree, I want to be its meaning."". ""Painting is the silence of thought and the music of sight."". ""A great painter does not content himself by affecting us with his masterpieces; ultimately, he succeeds in changing the landscape of our minds. Once a miniaturist's artistry enters our souls this way, it becomes the criterion for the beauty of our world."". ""But as with all lovers of color, he gets carried away with his emotions and is fickle."". ""It was Satan who first said 'I!' It was Satan who adopted a style. It was Satan who separated East from West."". ""I now understand that by furtively and gradually re-creating the same pictures for hundreds and hundreds of years, thousands of artists had cunningly depicted the gradual transformation of their world into another."". ""Books, which we mistake for consolation, only add depth to our sorrow.""","Apr 23, 2017"
44046886,Nafees Ahmed,"Orhan Pamuk does a rare thing with 'My Name is Red' - he patiently weaves artistic philosophy to voice the cultural difference with a murder mystery to keep passive audience engage. Venetian painting - conferring the immortality to the humans through deftly painted self-portrait causes the ruckus among the miniaturists of Istanbul who believe in imitating the work of their masters without the scope of subjective interference. Eastern art is governed by the perspective of Allah and Western art is governed by the of humans. Eastern style doesn't give scope for artistic exploration. Any form of individualistic style or originality is considered as blasphemy. A secret project is commissioned by the Ottoman Sultan that borders in imitating the Western style and thus results in the mysterious death of one of the miniaturists. It's a breezy read but beware, the subtexts are complex and allegorical nested stories, recurring in Pamuk's novel, make the story layered and intellectually gratifying.","Feb 26, 2019"
42705755,Shane,"My fickle heart longs for the West when I'm in the East and for the. East when I'm in the West.. My other parts insist I be a woman when I'm a man and a man. when I'm a woman.. How difficult it is being human, even worse is living a human's life.. I only want to amuse myself frontside and backside, to be Eastern. and Western both.. It took me quite a long time to read this book thus I feel like reading it was a journey of some kind. I was amused by how beautiful the author's way of writing is. Also the maestry of the translator Erdağ Göknar should be highlighted - I am very glad I chose the English version. Sometimes I used to feel overwhelmed by how dense the story was yet I was not considering putting it down. I decided to let myself enjoy this volume on my own pace. I was always picking it up with curiosity, interest and ready for a mind pleasure. Huge advantage of ""My Name Is Red"" is in my opinion the way it is structured. It is written considering different characters points of views. I was astonished how Pamuk could write a text from the perspective of a tree, gold coin, satan or death with the same artistry. It seems mind-blowing. The plot itself is not very complex. It is a story about love-obsession, art, skilled miniaturists who devotes their lives to illustrating books from the earliest years under the strong, demanding but also very affective eye of their master. It is also about death, life, ways of seeing, rebellion and revenge. It is about what could we give up for the things we believe in or love. The highest point of this book is definitely the way it was written. Masterpiece. I cannot wait to explore other creations by Orhan Pamuk.","Apr 14, 2019"
442654,Andrew,"I've been a Pamuk fanboy ever since I read The Black Book in college, and while I get the importance of My Name Is Red -- the extended aesthetic and religious discussions, the polyglot voices (including Satan and a dog), the delightful insertion of himself like Van Eyck painting himself in the mirror in the Arnolfini Wedding -- and I really appreciate it, I'm not sure to what extent I enjoyed the book as a whole. To be sure, the writing style was enjoyable and the discussions were elegant, but given the complexity of Pamuk's project, it's awfully hard to integrate as a whole. Part of me wants to go back and read each voice separately as its own novella. You should read this, absolutely. But I don’t know if it's everyone's cup of Turkish coffee.","Dec 11, 2018"
56224241,Saeed,"wow. i lived this book for 5 months. i started it while visiting topkapi palace in istanbul and it hunted me imediately.. very powerful style, a marvelous topic and great details, like miniature itself","Jan 21, 2020"
263205,Matthew,"Someone or other once said that ""self-confidence is knowing what you can't do well, and avoiding it."" While that perspective sounds like a recipe for a fairly limited life, there's an element of truth to it -- particularly when it comes to writing.. There's a kind of writerly skill that almost never gets mentioned in book reviews, because it precedes anything that appears on the page. It's the process of choosing a plot and structure for the as-yet-nonexistent novel: part inspiration and part calculation, a kind of half-conscious gestation during which the writer chooses a quarry that matches their particular strengths and weaknesses. We can call this the. cunning. of the author, which consists of (to revisit the maxim above) knowing what you can't do well, and avoiding it -- or better yet, turning that shortcoming to your advantage.. My Name Is Red. is possibly the best example of ""writerly cunning"" I've ever encountered. Ostensibly, the plot is a kind of stylized murder-mystery: at the Ottoman court in Constantinople, a miniaturist (manuscript illuminator) is killed while working on an innovative, possibly blasphemous book, and everyone scrambles to find out whodunnit. Within this ""frame story"" however,. My Name Is Red. is something much more: narrated by something like seven primary characters (with voices from a few secondary characters, and even inanimate objects, chiming in), it's a debate about individuality vs. tradition, and the nature of selfhood.. According to Ottoman tradition, a miniaturist should not have a recognizable painting style, and should not even sign their own work: they should function as anonymous clerks, revealing God's creation. Contact between this tradition and Venetian (western European) painting, in which individual style was highly valued, inevitably led to upheaval within the Ottoman artistic world. Each of the characters in this novel is torn between the ""old way"" of doing things, in which the significance of individuals (both in art and in life) is minimized, and the tempting (but perhaps blasphemous) idea that individual style has value and should not be hidden. In a reductionist sort of way, we might call this a tug-of-war between group- and individual-based notions of identity.. All of this is interesting enough, but Pamuk's stroke of genius is this: he simply cannot (it seems) convincingly write from multiple distinct points of view.. Brilliant.. By writing a novel told by multiple characters, each of whom longs to have an individual style --. but all of whom sound exactly the same. -- Pamuk illustrates dramatically the pathos of these characters, and the cognitive distance between the worlds they hope to bridge. This is a feat of writerly cunning and ingenuity that left me, quite simply, in awe.. On the other hand, as a reader, much of. My Name Is Red. left me cold. The sameness of all the voices in the novel does begin to grow tedious after awhile, and the stories-within-a-story told by various characters felt like contrived digressions. This is more a writer's book than a reader's -- but as a work of authorial architecture, it is a masterpiece.","Jan 07, 2009"
4037122,Tarfah,"Let me preface this by saying that from the get-go I felt that this book was just not my style; the author's style was just too convoluted, and the prose too high-brow. Having said that, I took this book as a personal challenge which I just could not put away unfinished.. The intrigue surrounding the book commissioned by the Sultan around which the entire story was based, and the murders that occurred due to the book's supposedly blasphemous content, were, in my opinion, really just an excuse to go on and on about the history of Arab, Persian (generally Eastern) artistry (calligraphers, illustrators, illuminators, etc.). Lovers of art and history would most likely be enraptured by My Name is Red.. Also, the never-ending repetition of the Shirin and Husrev love story was truly irritating. When I first started this book, I had never heard of them. By the end of it, I didn't want to hear any more! Same goes with the tale of the Whitesheep and the Blacksheep. I kept on thinking ""not this again!"". I also did not like the heroine Shekure in the slightest: hated her manipulative and conniving nature, and thought she was a terrible role-model for her sons, who, as the whim struck her, and as they suited her convenience, she could be cuddling one minute, then cruelly slapping the next.. The highlight of the story for me was the chapter ""I am a gold coin"". For someone who doesn't enjoy overly descriptive novels, I thought the imagery and the reader's imagination were truly captured in telling the story of the coin- truly wonderful.. My favorite character was that of the Jewess, Esther, whose colorfulness and busy-body meddling were truly entertaining, and whose character was the most relatable.. In short, I truly felt this book could have been ALOT shorter than it was- basically the entire story surrounding the Sultan's book and the associated murders could have been told in under 200 pages were it not for the over descriptive nature of the author's writing style and his continuous re-telling of the same/similar tidbits of artistic history.. I can understand why readers would enjoy this book, but it definitely isn't my style.","Jul 21, 2010"
4356644,Hira,"It is seldom that one picks up a book that bypasses any and all genres, and comes alive in your hands and speaks to you. Such is the kind of book Orhan Pamuk has written. Part love story, part murder plot, part commentary on all things spiritual - it is a beautifully written book with a great many multi-faceted characters.. Pamuk uses various different characters to narrate his book - some of the chapters even narrated by unusual characters such as the murdered corpse of Elegant Effendi, ""Ink"", a ""Coin"", Satan, two dervishes and the color ""Red"". It is especially the voices of these characters that become emblazoned upon your soul.. The plot lies in the murder of Elegant Effendi, the reason for which is stated to be his working on an illustrated book commissioned by the Sultan. 'Black', who is in love with late Elegant's daughter Shekure, is striving hard to uncover the murderer and win widowed Shekure's hand in marriage. Also, we hear from his fellow artists/miniaturists ""Butterfly"", ""Stork"" and ""Olive"", with their views on the West influencing Eastern arts. Thus, Orhan Pamuk is able to masterfully entwine a mystery, a romance, and allegory to the clash of Eastern and Western culture all in one wonderful book.. In his book, Pamuk writes ""An artist should never succumb to hubris of any kind, he should simply paint the way he sees fit rather than troubling over East or West."" - and that is precisely how Pamuk offers his progressive perspective, richly Eastern in nature, but pleasantly influenced by Western ideologies as well. He creates an amalgamation of both cultures, in which the values of each one are preserved and respected, and does it quite successfully. Olive, one of the miniaturists, offers his perspective on art as, ""Through our colors, paints, art and love, we remember that Allah had commanded us to ""See""!"" - and that is what Orhan Pamuk so craftily presents in this book, a chance for the reader to see beyond cultures and races, similarities and differences and be completely enchanted by the mystical, lyrical and awe-inspiring realm that ""My Name is Red"" is, as a novel.","Sep 29, 2010"
5603048,Jeruen,"This is a complicated read. It took me a month to read this, which was somewhat unexpected. So, what is this book about?. My Name is Red is a story about a murder, set in 1600 in Istanbul. An illustrator is found murdered, and the book weaves a story where the reader is kept guessing as to the identity of the murderer. Along with it is woven a story of love and sex, and family relations in the Islamic world.. The book is written in a post-modern style, and after reading this, I understand why the author garnered a Nobel Prize for this book. Every chapter has a different narrator, so the story is told through various points of view. Even atypical narrators are utilized in this story, including a gold coin, a corpse, a picture of a horse, and so on. With that I am impressed with the creativity of the author.. However, it took me a long time before I grew to like this book. Several factors came into play, for this to be the case. First of all, I am not at all familiar with the cultural references that the book has with respect to Istanbul and the Islamic World in the Middle Ages. The fact that there are several narrators also made things complicated, since I had a little bit of difficulty keeping track of who was who in the stream of events. It was after I finished half of the book that I started liking this novel, when the possible murderers were narrowed down to three.. No matter how I do not like the story, however, praise should be given to the structure. This is not just a simple airport novel. This is literature. I had to make full use of my brain when I was reading this. This was no simple read, and it required me to analyze and exercise some critical thinking in order to understand this novel.. All in all, I believe this is a very mature novel. People who only want some swooning mystery or romance will not find this enjoyable. Only people who want something that stimulates the brain will find this a great read. If you're one of those people, then by all means pick this book up.","Jun 09, 2011"
